id,author_id,title,slug,excerpt,body,created_at,updated_at
1,3,Pride and Prejudice,pride-and-prejudice,"A tour de force of wit and sparkling dialogue, with characters and themes that still resonate today. Both a romance full of gowns and","A tour de force of wit and sparkling dialogue, with characters and themes that still resonate today. Both a romance full of gowns andA tour de force of wit and sparkling dialogue, with characters and themes that still resonate today. Both a romance full of gowns andA tour de force of wit and sparkling dialogue, with characters and themes that still resonate today. Both a romance full of gowns andA tour de force of wit and sparkling dialogue, with characters and themes that still resonate today. Both a romance full of gowns and",2023-12-04 21:05:46,2023-12-04 21:05:46
2,7,Great Expectations,great-expectations,"One of the most renowned novels by this Victorian great, if you're looking for a Charles Dickens book to tick off of your literary bucket list, Great Expectations is a must-read.","One of the most renowned novels by this Victorian great, if you're looking for a Charles Dickens book to tick off of your literary bucket list, Great Expectations is a must-read.One of the most renowned novels by this Victorian great, if you're looking for a Charles Dickens book to tick off of your literary bucket list, Great Expectations is a must-read.One of the most renowned novels by this Victorian great, if you're looking for a Charles Dickens book to tick off of your literary bucket list, Great Expectations is a must-read.One of the most renowned novels by this Victorian great, if you're looking for a Charles Dickens book to tick off of your literary bucket list, Great Expectations is a must-read.",2023-12-04 21:06:19,2023-12-04 21:06:19
3,4,Little Women,little-women,"Thousands of teenagers around the world have fallen in love with Marmee and her four daughters: Meg, Jo, Beth and Amy. This semi-autobiographical novel charts the highs and l","Thousands of teenagers around the world have fallen in love with Marmee and her four daughters: Meg, Jo, Beth and Amy. This semi-autobiographical novel charts the highs and lThousands of teenagers around the world have fallen in love with Marmee and her four daughters: Meg, Jo, Beth and Amy. This semi-autobiographical novel charts the highs and lThousands of teenagers around the world have fallen in love with Marmee and her four daughters: Meg, Jo, Beth and Amy. This semi-autobiographical novel charts the highs and l",2023-12-04 21:06:46,2023-12-04 21:06:46
5,2,Frankenstein ,frankenstein,"Often copied but never bettered, Mary Shelley’s Frankenstein is the influential and shocking story of technology-created life, and is widely considered the first ever scie","Often copied but never bettered, Mary Shelley’s Frankenstein is the influential and shocking story of technology-created life, and is widely considered the first ever scieOften copied but never bettered, Mary Shelley’s Frankenstein is the influential and shocking story of technology-created life, and is widely considered the first ever scieOften copied but never bettered, Mary Shelley’s Frankenstein is the influential and shocking story of technology-created life, and is widely considered the first ever scieOften copied but never bettered, Mary Shelley’s Frankenstein is the influential and shocking story of technology-created life, and is widely considered the first ever scie",2023-12-04 21:26:52,2023-12-04 21:26:52
6,1,Orlando,orlando,"Following its immortal namesake through three centuries of history, Orlando is a whimsical exploration of perceptions of gender and love","Following its immortal namesake through three centuries of history, Orlando is a whimsical exploration of perceptions of gender and loveFollowing its immortal namesake through three centuries of history, Orlando is a whimsical exploration of perceptions of gender and loveFollowing its immortal namesake through three centuries of history, Orlando is a whimsical exploration of perceptions of gender and love",2023-12-04 21:30:56,2023-12-04 21:30:56
